{
  "schema_version": "1.0",
  "reviewer_role": "independent_portfolio_manager",
  "reviewed_at": "2026-10-01T05:24:19-04:00",
  "candidate_sha256": "102cdfd0ceaeb4f5e8978dc97464b9f196590998adec72cb7b201b182129465a",
  "verdict": "approved",
  "checks": {
    "official_policy": "pass",
    "pricing": "pass",
    "drivers": "pass",
    "market_validation": "pass",
    "freshness": "pass",
    "decision_usefulness": "pass"
  },
  "findings": [
    {
      "severity": "minor",
      "field": "macro_driver_recalculation.effective_weight_rule",
      "issue": "The clause 'the two Sep 30 cards (new GDP/PCE card) are 1 day old (x1.0)' overcounts: the payload contains exactly one card dated 2026-09-30 (fed_hawk_us_gdp_pce_20260930), and its own parenthetical names a single card, so 'two' appears to be stale drafting residue from an earlier plan to carry the Sep 30 double release as two separate cards.",
      "evidence": "Enumeration of every driver card id and published date (command output, this review run): fed_hawk_us_gdp_pce_20260930 is the only 2026-09-30 card; all others are 2026-09-25, 2026-09-29, 2026-09-11 (x2), 2026-09-04 (x2), 2026-09-24. The string is emitted verbatim by the build script (build_2026-10-01.py line 767). Operative decay (1 day -> x1.0) and all base weights are unaffected.",
      "pnl_impact": "None: no weight, age decay, rate, level or position size derives from the count; the only Sep 30 card is decayed correctly. At most a reader could briefly wonder which two cards are meant.",
      "instruction": "In the next natural rebuild, change 'the two Sep 30 cards' to 'the Sep 30 GDP/PCE card'; do not rebuild or hold publication solely for this."
    }
  ],
  "pnl_risks": [
    "FedWatch returned HTTP 403 again - the fourth consecutive daily snapshot with no single-meeting distribution (Sep 28-30 archives plus this build): ZQV26 96.110 is an October monthly (30-day) average EFFR whose average is set almost entirely before the Oct 28 decision - re-price the Wednesday marks before sizing any front-end position.",
    "CRAU26's executed print is thin (97.6375; 63 trades; volume 629) and its quote sides (97.6325/97.64; mid 97.63625) imply ~2.364% quarterly average CORRA spanning both the Oct 28 and Dec 9 decisions; it cannot be decomposed into either and a single small print is not a deep executable market.",
    "Friday's payrolls versus the ~90k pipeline consensus is the week's cheapest way to get hurt: the October average sits only 1.5 bp over the range midpoint and the long end has already been selling (TLT -3.33% on the week); a hot print compounds both, after today's claims (200k consensus), ISM (55.0) and the Fed-speak slate.",
    "The new weight-0.5 GDP/PCE card balances but does not settle the rope, and the BoC hawkish column is still empty by absence, not evidence: a strong September LFS on Oct 9 or an upward retail revision removes the dovish lean with no new BoC communication.",
    "Frame expiry: this view expires at Oct 9 (LFS + Michigan preliminary) and definitively at the Oct 27-28 / Oct 28 decisions; with FedWatch unavailable, the missing direct pricing becomes a view on the data itself."
  ],
  "operator_instructions": [],
  "executive_summary": "Round 1 (2026-10-01) - APPROVED. Independent sha256sum re-confirms candidate SHA-256 102cdfd0ceaeb4f5e8978dc97464b9f196590998adec72cb7b201b182129465a. Traceability: all 98 sha256-bound references in the payload (68 unique bound references) resolve to bytes on disk with matching sizes - including the six Yahoo ticker captures, the ZQ proxies, all ZN=F/6C=F event-window captures, the BLS API POST capture, the 60.4 MB StatCan LFS zip, the TMX CORRA page, both Fed/BoC official pages, and both new BEA release pages; every driver claim was re-found in its bound evidence. New Sep 30 card validated against the two bound BEA pages: both the third estimate (2.2%) and the second estimate (1.5%) are explicit in the GDP page's table ('Advance / Second / Third estimate: 1.5 / 1.5 / 2.2') with 'revised up 0.7 percentage point from the second estimate'; core PCE +0.2% m/m / 3.0% y/y, headline +0.3% m/m / 3.4% y/y, nominal PCE +0.9% ($190.8B), real +0.6%, and saving rate 4.1% all re-found in the PIO page; both BEA pages are byte-identical to my live re-fetches today. Recompute: 100 - 96.110 = 3.890, i.e. 1.5 bp above the 3.875% range midpoint; 100 - 97.63625 = 2.36375, about 11.4 bp above the 2.25% BoC target; the ZN=F Sep 30 release window (12:25-12:55Z, 104.5625 -> 104.546875, -0.015%) and the Sep 29 window (+0.090%, 13:55-14:25Z) recompute from the raw captures; all six ticker 1d/1w changes recompute exactly on the displayed-2dp rule. The CRAU26 capture carries exactly the claimed fields (last 97.6375; 63 trades; volume 629; bid/ask 97.6325/97.64; sizes 275/54; settlement 97.6275; open interest 237,993; expiry 2026-12-16). Live official checks today: the Fed statement shows the raise of the target range to 3-3/4 to 4 percent (3.75-4.00%), approved for release by a 12-0 vote - the payload asserts no vote count, so there is no contradiction to flag; the FOMC calendar shows October 27-28 and December 8-9*; both BoC pages are byte-identical to the captures (2.25% hold; next decisions Oct 28 with MPR, and Dec 9); the Michigan page states the next release: Friday, October 09, 2026 at 10am ET. Market marks: my live SPY pull shows the Sep 30 close 762.63 (bases 764.20 / 767.81); live ZQV26 shows the Sep 30 close 96.110 with the Oct 1 partial bar (96.1125) correctly declared not used; no Oct 1 regular-session price is claimed anywhere. Calendar rows: claims 200k/197k, ISM 55.0/54.6 and payrolls 90k (prior 162k) all re-found in the sha-bound economic-calendar pipeline artifact and are labelled pipeline-sourced, not official captures; the two StatCan date-only rows match the bound schedule JSON (Oct 6 trade, Oct 9 LFS); date-only is honest in both. Render: the pinned test suite passes 9/9 with data/latest.json staged and restored byte-for-byte (git status clean before and after); my own headless-Chrome dump of a scratch copy shows the Fed card '3.890% October monthly (30-day) average EFFR', the BoC card '2.364% quarterly average CORRA', the NO TRADE / NO EDGE neutral branch, both bank panels, all brief sections, and no fabricated odds - no page-vs-payload mismatch found. Structural gate: 13/13 PASS with brief regenerated True (2026-09-30-001 -> 2026-10-01-001); full suite 87 passed, 1 skipped (the pin-only tenor-key gate, which passed in the pinned render run). Decision usefulness: what changed (Sep 30 GDP/PCE outcomes; CRAU26's first executed print; marks advanced one session), priced-vs-unavailable stated exactly (monthly vs quarterly; FedWatch 403 again, nothing fabricated), dated falsifiers (Oct 2, Oct 9 x2, Oct 29, and the decisions) and largest P&L risks, with reasoned - not evasive - abstention, within a ~90-second read. The prior round's 'six business days' nit is resolved in this rebuild (the phrase is gone). One new minor, non-blocking wording nit is recorded below; no critical or major finding remains, so this candidate is approved for publication."
}
