{
  "schema_version": "1.0",
  "reviewer_role": "independent_portfolio_manager",
  "reviewed_at": "2026-09-30T04:00:40-04:00",
  "candidate_sha256": "abc1ac9a6c5bbdefd6da8f1e36766c2ed29d127b2027b98144e82ced233bcc7b",
  "verdict": "approved",
  "executive_summary": "Round 1 (2026-09-30) - APPROVED. Independent sha256sum re-confirms candidate SHA-256 abc1ac9a6c5bbdefd6da8f1e36766c2ed29d127b2027b98144e82ced233bcc7b. Traceability: all 75 sha256 bindings in the payload resolve to bytes on disk with matching sizes (47 unique files, including the six Yahoo ticker captures, the three ZN=F window captures, the 6C=F capture, the BLS API POST capture, the 60.4 MB StatCan LFS zip, the TMX CORRA page, and both Fed/BoC official pages); every driver claim was re-found in its bound evidence - in particular the new JOLTS card: the BLS capture (series JTS000000000000000JOL) shows 7,079k August vs 7,335k July = -256k, and a fresh live POST to api.bls.gov that I ran today returns the same 7079/7335. The LFS claim (July +75.1k, August -41.7k) recomputes from the bound zip (vector v2062811: June 21,139.7k, July 21,214.8k, August 21,173.1k; 5,466,528 rows streamed). Recompute: 100 - 96.110 = 3.890, which is 1.5 bp above the 3.875% range midpoint (was 2 bp at 96.105/3.895); 100 - 97.625 (CRAU26 mid) = 2.375, 12.5 bp above the 2.25% target; All seven ZN=F/6C=F event-window triples recompute from the raw captures to their displayed labels (Sep 4 payrolls -0.276%; Sep 11 CPI +0.176%; Sep 11 UMich -0.117%; Sep 25 final -0.090%; Sep 29 JOLTS +0.090%; 6C Sep 4 -0.552%; 6C Sep 24 -0.056%); all six ticker 1d/1w changes recompute exactly from the fresh daily captures on one displayed-2dp rule (SPY 764.20 -0.18%/-1.19%; TLT 78.23; XLF 54.01; XLE 61.54; GLD 382.89 +1.32%; ZEB.TO 74.34). Live official checks today: the Fed statement shows the raise of the target range to 3-3/4 to 4 percent (3.75-4.00%) with a 12-0 release vote - the payload asserts no vote count, so there is no contradiction to flag; the FOMC calendar shows the next meeting October 27-28 (December 8-9 following); the BoC decision and policy-calendar pages are byte-identical to the captures (2.25% hold; next decisions Oct 28 with MPR and Dec 9). Market marks are the Tuesday 2026-09-29 completed closes: my live Yahoo pull shows SPY regularMarketPrice 764.20 with the Sep 28 base 765.61, live ZQV26 shows the Sep 29 bar 96.110 (the 96.1075 pre-open partial is correctly not used), and the live TMX page shows the identical CRAU26 quote-side row (97.6225/97.6275, sizes 57/119, open interest 238993, no last print). 'The FedWatch dark spot persists - third straight snapshot' checks out: I verified that both prior published daily snapshots (data/archive/2026-09-28.json and the published 2026-09-29-003) carry the same 403/null FedWatch state, and this round's fresh request (2026-09-30T03:07:19-04:00) returned 403 again - the third consecutive daily snapshot. Refresh failures are recorded and never substituted (FedWatch 403; fxstreet 401 zero-byte; BLS schedule pages 403 with Sep 24 last-successful captures labelled; one auxiliary StatCan listing 404). Render: the pinned test suite passes 9/9, with data/latest.json staged and restored byte-for-byte (git status clean); my own headless-Chrome dump of a scratch copy shows the Fed card '3.890% October monthly (30-day) average EFFR', the BoC card '2.375% quarterly average CORRA', the NO TRADE / NO EDGE neutral branch, both bank panels and all brief sections, and no fabricated odds. Tenor keys verified at the proxy level: fed holds implied_monthly_average_rate=3.89 (monthly for monthly), boc holds implied_quarterly_average_rate=2.375 (quarterly for quarterly). Structural gate: 13/13 PASS with brief regenerated True (2026-09-29-003 -> 2026-09-30-001); full suite 87 passed, 1 skipped (the skip is the pin-only tenor-key gate, which passed 9/9 in the pinned render run). Decision usefulness: what changed (JOLTS card added, Canada GDP 0.0%, marks advanced one session), priced-vs-unavailable stated exactly (monthly vs quarterly; FedWatch null, nothing fabricated), dated falsifiers (Oct 2, Oct 9 x2, Oct 28) and largest P&L risks, reasoned - not evasive - abstention, all within a ~90-second read. One minor, non-blocking finding is recorded below (a stale 'six business days' count carried over from the prior round and still uncorrected); no critical or major finding remains, so this candidate is approved for publication.",
  "checks": {
    "official_policy": "pass",
    "pricing": "pass",
    "drivers": "pass",
    "market_validation": "pass",
    "freshness": "pass",
    "decision_usefulness": "pass"
  },
  "findings": [
    {
      "severity": "minor",
      "field": "decision_brief.largest_pnl_risks[1]; decision_brief.banks.fed.next_catalysts[1]",
      "issue": "The prose count 'six business days before the FOMC' is stale for the October cycle: Oct 2 to the Oct 27-28 FOMC is sixteen to seventeen business days (16 as of the Oct 27 meeting start, 17 as of the Oct 28 decision, excluding the Oct 12 holiday). The count was exact for the September cycle (Sep 4 -> Sep 15 = 6 business days excluding Labor Day) and has now survived one rebuild: the 2026-09-29 round-3 review logged this same nit as minor ('None blocking; do not rebuild solely for this'), and this fresh daily recollection still carries it. The endpoint dates in the same sentences are correct, and no rate, price, level or position size derives from the count.",
      "evidence": "Python enumeration of weekdays between 2026-10-02 and 2026-10-27/28 excluding Oct 12 = 16 / 17 (command output, this review run). Prior record: fed-boc-watcher/review/2026-09-29/iteration-03/pm-review.json, approved, single minor finding on the same phrase ('In the next natural rebuild, change the count to sixteen business days (or drop it); do not rebuild solely for this.'). Present occurrences in this candidate: largest_pnl_risks[1] '...Oct 2 payrolls lands six business days before the FOMC.'; banks.fed.next_catalysts[1] '2026-10-02 08:30 Toronto - U.S. Employment Situation (September). First hard-activity print of the window, six business days before the FOMC.'",
      "pnl_impact": "None blocking: every date, rate and price surrounding these sentences is correct; a reader could be mildly misled about how close the payrolls print sits to the FOMC, not about any market level or position size.",
      "instruction": "In the next natural rebuild (or any batch of edits), change the count to 'sixteen business days' or drop it; do not rebuild or hold publication solely for this - but do apply it, since the same note went unfixed through the rebuild that followed it."
    }
  ],
  "pnl_risks": [
    "FedWatch returned HTTP 403 again (no single-meeting distribution in this or the two prior daily snapshots): ZQV26 96.110 is an October monthly-average EFFR, not Oct 28 odds - re-price the Tuesday marks by hand before sizing any front-end position.",
    "CRAU26's quote side (97.6225/97.6275; no last print, volume 0) is an indicative two-decimal spread implying ~2.375% quarterly average CORRA across both the Oct 28 and Dec 9 decisions; it cannot be decomposed into either and is not a verified executable price.",
    "Data-wall risk with no bound consensus (fxstreet 401): today's 08:30 ET double release (Q2 GDP third estimate plus August PCE) and Friday's payrolls can each reprice the front end; the pre-committed thresholds (ZQV26 outside 96.00-96.25; payrolls vs the 3.890% no-move pricing) are the only falsifiers.",
    "The dovish JOLTS increment (weight 0.5) is one release from a low base: a rebound in the next JOLTS print unwinds it with no Fed action at all, and the BoC hawkish column is empty by absence, not by evidence.",
    "Frame expiry: both decisions land within four weeks and the average contracts can reprice on December without the Fed moving; by Oct 9 (Michigan preliminary, Canada LFS) the missing FedWatch pricing becomes a view on the data itself."
  ],
  "operator_instructions": []
}
