{
  "schema_version": "1.0",
  "reviewer_role": "independent_portfolio_manager",
  "reviewed_at": "2026-09-13T12:25:08-04:00",
  "candidate_sha256": "44e8ae06881186f2bf9aff8f3d2aa6bdb4827f6f10c9ef2c0faa22bbc42b45cf",
  "verdict": "approved",
  "executive_summary": "Approved. I independently reviewed the frozen candidate, exact candidate digest, PM handoff, all 51 hash-bound evidence files, open chronology feedback, and prior PM review. The prior as_of chronology defect is remediated: the 2026-09-13T12:21:19-04:00 candidate boundary is later than every nested recollection or observation. Official Fed and BoC policy facts, pricing limitations, driver semantics, market arithmetic, freshness, and decision-useful risk framing pass review. The preserved remediations also hold: rounded-only zero-weight JOLTS, neutral matched BoC hold, CRAU26 volume 33,077 with its multi-meeting limitation, neutral no-forecast context, and the capped Warsh signal.",
  "checks": {
    "official_policy": "pass",
    "pricing": "pass",
    "drivers": "pass",
    "market_validation": "pass",
    "freshness": "pass",
    "decision_usefulness": "pass"
  },
  "findings": [],
  "pnl_risks": [
    "Fed pricing is a desk-implied ZQU26/EFFR interpolation rather than direct CME FedWatch probabilities; basis and model risk remain material for event sizing.",
    "CRAU26 is a quarterly-average CORRA futures proxy spanning the October 28 and December 9 decisions, so it cannot be converted into a clean October cut, hold, or hike distribution.",
    "The driver set combines official releases with survey, calendar, and market-context inputs; the candidate appropriately labels mixed signals, limits weights, and avoids unsupported event-causation claims.",
    "The upcoming Canada CPI, US retail-sales, FOMC, and BoC deliberations events can reprice CAD, front-end rates, duration, and risk assets before the next policy decisions."
  ],
  "operator_instructions": []
}
